,Tweet_lemmatized
0,Teterower See aktuell heute See Schilf Teterow Mecklenburgvorpommern Mecklenburg Mvtutgut mv Smartphone Handy Handyfoto Handyfotografie Cubot J Effekt Farbtrennung Teterower See
1,Auto Ankauf heute sofort
2,Zdfchinareporter Ulfröller heute kritisch China Olympiade Diktator sein Winterolympiade kommen Demokratie Polenstaatsshef Besuch Faktum sollen Zdf heute schon stimmen Foto Shanghai
3,Tks Gedenkkundgebung Potsdam Recht Terroranschlag Hanau heute Jahr schildern werden außerdem
4,Auto Ankauf heute sofort Bargeld
5,Auto Ankauf heute
6,heute Sturmgraz Rapidwien live Skysportaustria
7,gut Frau heute Briefchen Berlin Finanzamtberlin Mittetiergarten öffnen tun Berlin Nic
8,Hmm Ungepflegte Vagina Okay Kochinnen Okay Tattoos Undoder Körperbehaarunginnen Okay
9,wer Text lesen erfahren Österreich geben jedenfalls vorerst Bericht sogenannter Coronaarm Impfung heute
10,Liebe warum trinken neu Restaurant gut Italienerin groß Interesse erklären Amp nein müssen bedienen dabei heute Chauseestrasse zeigen wissen weidt genießen hoch
11,Top Artikel erfahren woher Erektionsproblem Jährigen tatsächlich kommen unklar warum Sowas Aufmacher Headline heute
12,Artikel stehen Zahl Impfung steigen Meldung allergisch Reaktion kontinuierlich aktuell Auffälligkeit warum stehen Headline viele heute
13,zahlreich Beispiel Artikel lesen laut Autopsie Tod jugendlich Kausal warum stehen Headline enthüllen heute
14,d A Y T O n A Nascar heute Germanhomeofnascar
15,gut deutsch morgens wichtig komisch analog Post öffnen heute mittags wichtig
16,heute morgen Politik Medium Schweigen müssen verbreiten Neinzurimpfpflicht nein Impfpflichtab Heutemorgen
17,riesig Unzufriedenheit Türkisgrüner Regierung darunter Zensur heute folgend Kommentar
18,Information demsein Rojas Tovar geben nie Pseudonym vollkommen unwichtig Model Wearenato Worldarmy Foxnews Cbsnews Forbes Nbcnews Nbc Cnn Usatoday we Serve The World Rtl Bild Cdu Zdf Tagesschau Ard heute Heutejournal Tagesthemen
19,Gefangen Olympiade Gitter Freiheit berauben opfern Gier Geldspiel Schande Freiheit Olympia Olympic Olympischespiele Pressefreiheit Menschenrecht Peking Peking Tagesschau Tagesthemen heute Sportschau Sportbild Bild
20,riesig Unzufriedenheit Türkisgrüner Regierung darunter Zensur heute folgend Kommentar x neu umschreiben parteiisch Moderator regierungskritisch At zensieren
21,gut morgen heute Sagenschreiben Sinn Geweseninnen Problematik Zeit is
22,Trick it s Not A Trick it s A Sony eben Platztbuff haben löschen heute
23,Margaritaa Chatte heimlich Lovelove heute Geilemucke
24,letzter Tag Kodass glatt Ulli Artikel At heute übersehen erzählen s
25,Hmm Ungepflegte Vagina Okay Kochinnen Okay Tattoos Undoder Körperbehaarunginnen Okay denken legen schließlich früh heute Sunday February Amp Pisces Sunday March M hi hi
26,letzter Tag Kodass glatt Ulli Artikel At heute übersehen erzählen s
27,letzter Tag Kodass glatt Ulli Artikel At heute übersehen erzählen s
28,letzter Tag Kodass glatt Ulli Artikel At heute übersehen erzählen s
29,letzter Tag Kodass glatt Ulli Artikel At heute übersehen erzählen s
30,letzter Tag Kodass glatt Ulli Artikel At heute übersehen erzählen s
31,letzter Tag Kodass glatt Ulli Artikel At heute übersehen erzählen s
32,gut Frau heute Briefchen Berlin Finanzamtberlin Mittetiergarten öffnen tun Berlin mehr mögen lang warum Mittetiergarten warum Einbildung Bildung hä Kûss
33,Erzählung via Alexander ausschließlich Blanca kennen beruhen Gg A sy
34,gut Nachricht zweiter Packung Pinselschimmel gefuttert Termin heute Wek wg komisch tw
35,Trottel heute fallen natürlich Kriegspropaganda Filmchen Flucht Bunker rein einfältig gehen wohl kaum
36,Bayern München Greuther Fürth Bundesliga Prognose Amp Wetttipps Spieltag Shorts Fussball heute Tipps
37,liefern Waffe Ukraine moralisch Unschick ja jemand umbringen Lambrecht heute p s überweisen Mrd Euro Ukraine woanders Waffe kaufen bitte weitersagen
38,Gedenkkundgebung Potsdam Recht Terroranschlag Hanau heute Jahr schildern werden außerdem Todesopferrechtergewalt seit erinnern Onthisday Otd Saytheirnames Hanauistüberall Rechtenterrorstoppen rassismustötet
39,heute Matthäus schwarz Hauptbuchhalter Fuggergesellschaft Jakob schreiben Anleitung Musterbuchhaltung mögen Gewänder hinterlassen Trachtenbuch inklusive Verzeichnis anlassen Umstand Beginn Mutter schwanger Akt
40,Gott Herr Wortener Nummer richten Gedanke Amp Plänemein Leben Ausweil Herr Istbewegt Frage heute Verhalten Mitmensch beten Oberst Priorität geben Trost Trauer Hanau
41,Afd Saarland Spitzenkandidat mehrere Mitglied gegenseitig verklagen mögen Nachricht Zdf heute
42,Tod Jesus Christus letzter Wort geben Zukunft Grenze Sterben
43,Bild Bildlive Cicero Welt Merkur Tagesschau Tagesschau Heutejournal heute wer berichten erster Breakingnews Nachricht
44,Gardelegen Gedenken heute Otd ermordet Anschlag Hanau heute Otd Jahr Mitgefühl gelten
45,Tod Jesus Christus letzter Wort geben Zukunft Grenze Sterben Zukunft Verbindung Jesus beginnen schon heute
46,faustmannsch Bodenertragswertformel berechnen ausbeuten Wald Förster heute Martin Faustmann erfinden Spiegelhypsometer Höhenmessung erstellen Formel hessisch Forstwitwenkasse erster Nutznießer jährlich Erhöhung Weib
47,Gardelegen Gedenken heute Otd ermordet Anschlag Hanau heute Otd Jahr Mitgefühl gelten
48,Liebe At heute finden großartig Reichweite nutzen Leserinnen Longcovid Postco
49,heute Heinrich Leopold Wagner Schriftsteller Sturm Drang heiraten Jährige Witwe drei Jahr Erde bringen Kindermörderinn lungentuberkulos machen unbedeutend Goethianer
50,Gorlowka heute Haus zerschießen Ukraine Ruine Nazi Armee
51,Gorlowka heute Haus zerschießen Ukraine Ruine Nazi Armee
52,Nazi Flugblätter Russland Wwiii heute Wort wörtlich gleich Donbass abwerfen
53,Sprengstoff Brückenpfeiler entschärfen Brücke Strasse Mensch Sicherheit bringen Lugansk heute Ukraine Terror Nazi
54,Hundekeks heute Kaustange Eviledition Dogsoftwitter Twitterrudel
55,heute Kaustange Eviledition Dogsoftwitter Twitterrudel
56,heute Nomnom Nagnaglecker Kaustangearbeitbin konzentrieren Dogsoftwitter Twitterrudel
57,Onlineabstimmung Impfpflicht heute dagegen Impfpflicht Rest wissen Anzahl d
58,letzter Tag Kodass glatt Ulli Artikel At heute übersehen erzählen s
59,Geld Islam Schweiz Wissen wollen Antwort veranstalten
60,Pragmatismus Kanzler Merkel Partei linksliberal Milieu angleichen hoffen viele Cdu Veränderung Parteichef Merz konservativ Revolution anführen Konservatismus heute
61,Geld Islam Schweiz Wissen wollen Antwort Veranstaltung zuerich heute abend endlich mal Zoomtreffen live
62,letzter Tag Kodass glatt Ulli Artikel At heute übersehen erzählen s
63,letzter Tag Kodass glatt Ulli Artikel At heute übersehen erzählen s
64,letzter Tag Kodass glatt Ulli Artikel At heute übersehen erzählen s
65,letzter Tag Kodass glatt Ulli Artikel At heute übersehen erzählen s
66,Liebe At heute finden großartig Reichweite nutzen Leserinnen Longcovid Postco
67,letzter Tag Kodass glatt Ulli Artikel At heute übersehen erzählen s
68,Liebe At heute finden großartig Reichweite nutzen Leserinnen Longcovid Postco
69,Liebe At heute finden großartig Reichweite nutzen Leserinnen Longcovid Postcovid Mecfs Co erzählen Artikel verpacken Info erfreulicherweise immer korrekt vielen betroffen helfen danken dafür
70,letzter Tag Kodass glatt Ulli Artikel At heute übersehen erzählen Geschichte
71,Befehl Besetzung Deutschland Wearenato Worldarmy Foxnews Cbsnews Forbes Nbcnews Nbc Cnn Usatoday we Serve The World Rtl Bild Zdf Tagesschau Ard heute Heutejournal Tagesthemen
72,Happy Birthday Falco Birthday Today heute Geburtstag Remember Erinnerung Blog Bluesanne Lesestoff Themusicinme
73,heute ordnungsgemäß angemeldet Demonstration Kaiserslautern Jugend Fridaysforfuture Kind Eltern
74,heute ordnungsgemäß angemeldet Demonstration Kaiserslautern Jugend Fridaysforfuture Kind Eltern Pfalz Wirwerdenlaut Lockerung Pfälzer Schule Kaiserslautern Rheinlandpfalz Weinstraße Pfalz Ichbinungeimpft impfen Ungeimpft Impfpflicht
75,Befehl Abschuss Wehrsportgruppen weltweit Fremdenlegion Topaces Richthofen wing inklusive Nutzung Neutronenbomben Wearenato Worldarmy Foxnews Cbsnews Forbes Nbcnews Nbc Cnn Usatoday Zdf Tagesschau Ard heute Heutejournal Tagesthemen
76,Gardelegen Gedenken heute Otd ermordet Anschlag Hanau heute Otd Jahr Mitgefühl gelten
77,Wochenende Zeit Kunst heute Uhr geöffnet Überblick brauchen Uhr finden kostenlos Führung Kennenlernen Nuernberg statt Gnm Museum Nuernberg Otd Art
78,Gardelegen Gedenken heute Otd ermordet Anschlag Hanau heute Otd Jahr Mitgefühl gelten
79,Gardelegen Gedenken heute Otd ermordet Anschlag Hanau heute Otd Jahr Mitgefühl gelten
80,Gardelegen Gedenken heute Otd ermordet Anschlag Hanau heute Otd Jahr Mitgefühl gelten
81,Gardelegen Gedenken heute Otd ermordet Anschlag Hanau heute Otd Jahr Mitgefühl gelten
82,Onlineabstimmung Impfpflicht heute dagegen Impfpflicht Rest wissen Anzahl d
83,Gardelegen Gedenken heute Otd ermordet Anschlag Hanau heute Otd Jahr Mitgefühl gelten
84,Gedenken heute Otd ermordet Anschlag Hanau heute Otd Jahr Mitgefühl gelten Angehörige Hinterblieben Wirsagenihrenamen Saytheirnames rassismustötet Rassismus Rechtsextremismus Rechtsterrorismus gegenrechts Erinnern
85,lieben Handel Ruhe kommen Game over immer schwer heute Rest
86,Onlineabstimmung Impfpflicht heute dagegen Impfpflicht Rest wissen Anzahl d
87,Onlineabstimmung Impfpflicht heute dagegen Impfpflicht Rest wissen Anzahl d
88,K eigen Kraft Angriff ex Ukraine Nazi Armee geflüchtet K organisiert evakuieren Lugansk heute
89,Arminia Bielefeld Union Berlin Bundesliga Prognose Amp Wetttipp Spieltag Shorts Fussball heute Tipps
90,Fc Köln Eintracht Frankfurt Bundesliga Prognose Amp Wetttipp Spieltag Shorts Fussball heute Tipps
91,Gorlowra heute ex Ukraune Nazi Terror
92,Gorlowra heute ex Ukraune Nazi Terror
93,Onlineabstimmung Impfpflicht heute dagegen Impfpflicht Rest wissen Anzahl d
94,Onlineabstimmung Impfpflicht heute dagegen Impfpflicht Rest wissen Anzahl d
95,Onlineabstimmung Impfpflicht heute dagegen Impfpflicht Rest wissen Anzahl d
96,Onlineabstimmung Impfpflicht heute dagegen Impfpflicht Rest wissen Anzahl d
97,Onlineabstimmung Impfpflicht heute dagegen Impfpflicht Rest wissen Anzahl d
98,Onlineabstimmung Impfpflicht heute dagegen Impfpflicht Rest wissen Anzahl abstimmend
99,fast abschalten heute Tagesthemen Heutejournal
100,halblustig Nusser heute Sonntag Pressestunde Polaschek halbseiden unkritisch Frage stellen Farce Gi bezahlen
101,Sprachnachricht Whatsapp lang Minute daueren seit heute Podcast deklarieren
102,lieben Berichtetverschlußgdrssi befreien heute soeben verblieben
103,Guitar Walkingguitar ja heute Februar Feb i Draussen Guitare Musizieren unterwegs
104,heute Rolf Erich Osterwalder studieren Zeit anstatt Kampf gründen Hazyosterwaldsextett amerikanisch Musikergewerkschaft lehnen ab Nwdr Auftritt klein groß Reise bereits verfilmen
105,letzter heute Charlotte Amalie Hessenwanfried verheiratet reich Mann Ungarn Fürst Franz ii Rákóczi vo
106,ja sogar erster Orkanbö Gütersloh Glückwunsch erster heute Wetter
107,Liebe Bayern Import Lebensmittel Amp Futtermittel Brasilien einfach viele Pestizid Spiel laut süddeutsch Zeitung heute Brasilien drohen Giftboom sz Faz Zeit Nzz Spiegelonline
108,Berlin Lauterbach heute pk Hundearzt Rki präsentieren neu Chef Prof Lars Schaade Arzt Wieler fertisch Friedlichzusammen Lauterbachluegt Drostenluegt Wielerluegt
109,Zdfnachrichtensendung heute werden gerade glatt lügen sagen werden Novavax sein klassisch Totimpfstoff falsch
110,Nachrichtensprech Machthaber Putin Diktator Lukaschenko Usw Frage mal sagen eigentlich Machthaber Olaf Scholz heute Zdf
111,Gesundheitsminister warnen echt heute
112,heute Charlotte Amalie Hessenwanfried verheiratet reich Mann Ungarn Fürst Franz ii Rákóczi Felsővadász Hilfe Türke letzter Magyar Habsburg erheben traurig Ächtung kommen unehelich Kind Welt
113,Pain Compensation For Familie Of victims Wearenato Worldarmy Foxnews Cbsnews Forbes Nbcnews Nbc Cnn Usatoday we Serve The World Rtl Bild Zdf Tagesschau Ard heute Heutejournal Tagesthemen
114,münchner Sicherheitskonferenz heute drohen neu Krieg Baerbock blinken warnen Eskalation Ukraine
115,münchner Sicherheitskonferenz heute drohen neu Krieg Baerbock blinken warnen Eskalation Ukraine
116,heute Jahr werfen geschwisterscholl Flugblätter Lichthof Lmu werden Verhaftet Un
117,heute Jahr finden Uraufführung Vielka Oper giacomo Meyerbeer Theater Wien statt Adaption Singspiels Feldlager Schlesien Text Ludwig Rellstab Charlotte Birchpfeiffer überarbeitet
118,heute Jahr werfen geschwisterscholl Flugblätter Lichthof Lmu werden Verhaftet Un
119,victims Of Wolframvanlessen Monster Sheepfur Wearenato Worldarmy Foxnews Cbsnews Forbes Nbcnews Nbc Cnn Usatoday we Serve The World Rtl Zdf Tagesschau Ard heute Heutejournal Tagesthemen
120,heute Jahr werfen geschwisterscholl Flugblätter Lichthof Lmu werden Verhaftet Un
121,heute Johann Hartwig Ernst Graf Bernstorff Außenminister Kg Friedrich v u Christian vi hz sh v dk Meister Vertrag lösen Konflikt Holstein Gottorf einigen Tausch Katharina ii sh erstmals seit jh lernen nie dänisch ersetzen v Struensee
122,heute Jahr werfen geschwisterscholl Flugblätter Lichthof Lmu werden Verhaftet Tod Verurteilt Denkstätte Weißerose können studentisch Widerstand genau informieren
123,Fsv Mainz Bayer Leverkusen Bundesliga Prognose Amp Wetttipp heute Spieltag Shorts Fussball heute Tipps
124,lieben Berichtetverschlußgdrssi befreien heute soeben verblieben Vodafonetripleplay Fnphone Fr Langguthfamittetiergarten Pfändung aufheben Wait Wednesday February Fax senden lieb
125,Festnahme Unfall Einbruch viele aktuell Blaulichtmeldung heute Nordnews Übersicht Emsland Grafschaftbentheim
126,New ja löschen Datum Umg Amp Sonymusic möchten hi hi beantragen h
127,Fotovorschlag heute Fantasie Meinfoto Lichtfoto Stimmungsfoto Sonnenuntergang Sunset
128,Ferienbeginn Linztoday Linz Termin heute Ferien Today Ferienbeginn fast Schüler oberösterreich Linztoday Linz
129,Guitar Walkingguitar ja heute Februar Feb i Draussen Guitare Musizieren unterwegs
130,Guitar Walkingguitar ja heute Februar Feb i Draussen Guitare Musizieren unterwegs
131,Walkingguitar ja heute Februar Feb i Draussen Guitare Musizieren unterwegs Ontheroad Amp ja klar live mal But ecken egal Schnitt Sec music rock rocknroll Unplugged walknrocknroll
132,Meerseburger prägend Journalist westdeutsch Mediumenlandschaft Zdf heute warum einfach deutsch
133,widerrufen seit Mai Wearenato Worldarmy Foxnews Cbsnews Forbes Nbcnews Nbc Cnn Usatoday we Serve The World Rtl Bild Zdf Tagesschau Ard heute Heutejournal Tagesthemen
134,Osten gehen Sonne Filmstart Woche finden immer Filmstart Wuppertal heute Kinostart Filmstart Kino Film Arthaus Independent Independentfilm Cineast Filmliebe Wuppertal Engelswuppertal Engelskultur
135,heute Gustav Leutelt sudendeutsch Dichter sterben Vertrieben fern Heimat Heimat Wurzelwerk Weltbaum aufsteigen weder Heimatliebe Weltflucht Allerweltsliebe Geringschätzung Heimat gut
136,heute Gen Inf Rudolf Ernst Otto Gercke Soldat seit wk ua Korps Falkenhayn Grenzschutz Ost Heerestransportchef okh plötzlich Planung einbeziehen lassen drei Tag Schaufel Ardennenoffensive vorbereiten Vskl Marburg
137,heute Jahr laufen Vw Käfer Band s Hellblaumetallik verweisen Ford T Platz Meistgebauten Auto
138,heute polnisch Teilung Unruhe ewig Vertrag De facto russisch Protektorat Kg Poniatowski unterstützen ö u Fr führen Dilemma zudem osman Krieg erklären Defensivallianz Preußen Zwang Handeln ö lieber dabei
139,morgen Wirds mild heute Wetter
140,gerade eben heute Soldatinnen Mali Soldatinnen jedoch Sehengender
141,Zdf heute Gendergaga Wort Bild Soldat Rülps Innen
142,erster Lockerung Nrw treten Samstag Kraft Nachricht Meldung neu Wissen aktuell heute Corona Coronavirus Covid coronakrise Pandemie Deutschland wüst Kontaktbeschränkung geimpft Genesene Einzelhandel G Maskenpflicht
143,Reliquie Schacher Kirchenmann heilig Knochen Welt Archäologie Geschichte
144,März warum Begriff Freedomday passen Nachricht Meldung neu Wissen aktuell heute Corona Coronavirus Covid coronakrise Pandemie Impfung impfen Deutschland Ampel Fdp Lockerung Scholz Lindner wüst Lauterbach
145,Reliquie Schacher Kirchenmann heilig Knochen Welt Archäologie Geschichte Forschung Wissenschaft Nachricht Wissen aktuell heute mittelalt Byzanz Konstantinopel Kirche Österreich Wien Kreuzzug Christ Christentum
146,Oggi Today heute Aujourdhui Hui hi via Cucina Tagliatelle Co Funghi Champion Gianna Nannini Cook Mushrooms no Wrong Champignon dr brutzeln Brät Fries to Figur kochen hats leicht Cook
147,Heutegesternmorgen Fettsuppe Lindner Pianist
148,einfach dankbar glücklich Vitaminsea genießen Welle lauschen heute gut Tag Fuerteventura Freedomday
149,Wearenato Worldarmy Foxnews Cbsnews Forbes Nbcnews Nbc Cnn Usatoday we Serve The World Rtl Bild Cdu Nordrheinwestfalen Cdu Paypal Spd Fdp Diegruenen Dielinke Afd Csu Zdf Tagesschau Ard heute Heutejournal Tagesthemen Qanon Wolframvanlessen
150,damals heute Jahr Portrait Fotograf Nikon Witten Fotografie Fotografiebochum fotografiedornbusch Fotografiedortmund Blackandwhite Blackandwhitephotography Selbstportrait creativ Crativephotography Schwarzweissfotografie Woman Girl Face Eyes
151,Schwarzbauten Zypern Richthofen Wearenato Worldarmy Foxnews Cbsnews Forbes Nbcnews Nbc Cnn Usatoday we Serve The World Rtl Bild Zdf Tagesschau Ard heute Heutejournal Tagesthemen
152,Hello Pillow love Lovemyjob Butterflies Cute Donnerstag heute Collection free Supportsmallstreamers Thankyou
153,Hello Pillow love Lovemyjob Butterflies Cute Donnerstag heute Collection free Supportsmallstreamers Thankyou
154,Hello Pillow love Lovemyjob Butterflies Cute Donnerstag heute Collection free Supportsmallstreamers Thankyou Loveisintheair Youngcouple Fashionblogger Findyourthing Redbubble
155,Kuenstler heute Tagdergrundlosennettigkeiten Hach nett haben mal bissch Kleingeld fü
156,heute Tagdergrundlosennettigkeiten Hach nett haben mal bissch Kleingeld Kaffetasse
157,Heuteat Adolf Fpö Trash Amp Fake ijh Neädth Anschau Blätterblatt Gross deijhdthsch Dühmmelden Schröder Albertina Aufsichtsrat Eva Dichand Ihrrer Faschoiden Klientel schämen
158,danken Offenheit Ausgleich wünschen heute Ehrentag hell Leichtigkeit vielleicht sogar paar strahlend Glücksmoment gut Geburtstag viele wunderbar Wohlfühltage neu Lebensjahr Liebe Bettina Happybirthday
159,Ulm Eu beschlossen Atomkraft Erdgas nachhaltig Regelung denken Greenwash
160,Einsatz Feuerwehrhh Sturm Ylenia Hamburg bleiben Nacht relativ ruhig Fischmarkt laufen
161,gut deutsch heute Montag or Sunday February Sleep Well
162,halten kurz fest i heute morgen Schriebinnen soeben komisch Kioskbesitzer Überfall
163,Einsatz Feuerwehrhh Sturm Ylenia Hamburg bleiben Nacht relativ ruhig Fischmarkt laufen
164,Einsatz Feuerwehrhh Sturm Ylenia Hamburg bleiben Nacht relativ ruhig Fischmarkt laufen
165,Einsatz Feuerwehrhh Sturm Ylenia Hamburg bleiben Nacht relativ ruhig Fischmarkt laufen
166,Einsatz Feuerwehrhh Sturm Ylenia Hamburg bleiben Nacht relativ ruhig Fischmarkt laufen
167,Einsatz Feuerwehrhh Sturm Ylenia Hamburg bleiben Nacht relativ ruhig Fischmarkt laufen
168,Einsatz Feuerwehrhh Sturm Ylenia Hamburg bleiben Nacht relativ ruhig Fischmarkt laufen
169,Ulm Eu beschlossen Atomkraft Erdgas nachhaltig Regelung denken Greenwash
170,Ulm Eu beschlossen Atomkraft Erdgas nachhaltig Regelung denken Greenwash
171,Eu beschlossen Atomkraft Erdgas nachhaltig Regelung denken Greenwashing verhindern Greenwashing Betrieb Radio Freefm Talksforfuture heute Fridaysforfuture
172,Bundesregierung Bundespräsident Bundeskanzler Chancellor germany Deutschland Usarmy Wearenato Worldarmy Foxnews Cbsnews Forbes Nbcnews Nbc Cnn Usatoday Rtl Bild Zdf Tagesschau Ard heute Heutejournal Tagesthemen
173,Einsatz Feuerwehrhh Sturm Ylenia Hamburg bleiben Nacht relativ ruhig Fischmarkt laufen Uhr voll Sturm frischen stark mehr heute Drehscheibedeutschland
174,Ylenia Wumms Hamburg heute
175,heute groß Tag freitesten drücken mal Daumen
176,erst sch Maskenpflicht mehr bestehen Lockerung Abwägen Sinn machen allgemein daran festklammern Brillenträger Qual heute Kutschaty Bundesregierung Corona
177,historisch Reklameblech Zaunschild Chen heute extrem selten Rudolf Voigt Drahtzäune Frontgitter Bln Frohnau Oranienburg Chaussee Berlin
178,inzwischen schalten reflexartig versehentlich Tagesschau heute landen halten Propaganda Sekunde mehr Örr Ard Zdf
179,heute Jahr erster polnisch Teilung Österreich billigen bekommen Stück nunmehr Friedrich Preußen statt
180,Blume heute Mariendorferdamm
181,heute Heinzwolfgang Schnaufer Njg Ghost Of st Trond erhalten brillant d Ek Geburtstag spielen Bbc erfolgreich Nachtjäger Le Nachtgespenst schießen Lancaster ab sterben unverschuldet vu Frankreich
182,Tagesschau heute einschalten freuen Lockerung machen deshalb stecken Massnahmen dorthin niemals scheinen Arsch
183,heute Karl Wilhelm Buch Ökonom erstellen Gesetz Massenproduktion besagen zunehmend Produktionsmenge Produktionskosten pro Stück Stückkosten sinken sowie Gewinn Bzw Nutzenschwelle Breakevenpoint Erlösekosten wer d Urne
184,lieben Handel Ruhe kommen Game over immer schwer heute Restaurant bewachen müssen bekommen Einlass Antikörpertest Amp digital id card Amp Schakschuka finden Sleep Well Kûss
185,schon Uhr drohen ganz Deutschland stürmisch Böen heute Wetter
186,mal Zdfinternes Heutesendung genehmigen Shakuntala erstmal Banerjeedrink
187,heute Nachricht Gendern Kotzen Zdf Oerr abschaffen
188,heute Heinrich Raspe iv einzig König thüringisch Ludowinger siedeln deutsch Orden Marburg zuerst Reichsgubernator Verwalter Friedrich ii Hilfe Kirche Gegenkönig L Wilhelm v Holland r Gen pfaffenkönig
189,heute Jakob Fischbacher Bayernpartei Bauernsohn Norddte Blondine heiraten Diesblutschandepreuß Zeug u Flüchtling müssen hinauswerfen u d Bauer Müssenmithelfenam Gute schicken Preußen gleich Sibirien
190,heute Fürstabt Fulda Heinrich Vii Kranlucken Kompromißkandidat reisen Bestätigung Avignon Karl iv verleihen Investitur Erzkanzler Kaiserin ernennen seit Saliern abschaffen sitzen linker Kaiser halten Krone
191,Zdf laufend Sendung Minvor deren Ende heute Spezial Corona unterbrechen Mittwoch ja Krieg Ausbrechen
192,Zdf heute verwendet Filmmaterial fasch Azowbataillons Berichterstattung Ukraine
193,Zdf heute verwendet Filmmaterial fasch Azowbataillons Berichterstattung Ukraine
194,Termin Gtgtgt Coma Mazlum Nergiz heute Uhr Uhr Uhr Uhr Regie Marcel Schwald Choreografie Johanna Heusser Uraufführung Choreografie Männerkörper Cruising Ticket Gtgtgt
195,heute Philipp Schwartzerdt Mélanchthṓn Praeceptor Germaniae Lehrer Deutschland Evangel Dogmatiker Loci Communes schreiben Glaubensbekenntnis Confessio Augustana Apologie Briefwechsel Calvin Bullinger Erasmus v Rotterdam Professor Wittenberg
196,Familie Vanlessen grundsätzlich Psychopathen Familie Neumann Waa Grubel Weltfrieden Wearenato Worldarmy Foxnews Cbsnews Forbes Nbcnews Nbc we Serve The World Rtl Bild Zdf Tagesschau Ard heute Heutejournal Tagesthemen
197,Hundekeks heute Ball Ball Mensch summen Dogsoftwitter Twitterrudel
198,heute Ball Ball Mensch summen Dogsoftwitter Twitterrudel
199,passend Jahrestag Sturmflut Hamburg heute Hhflut Remember Jahr
200,unbekannt Grund bekommen Österreich heute italienisch Nom.sg.masc Youtube Generated finden schön erster Ton Sommer Italien heute
201,Stromknappheit Unternehmer fordern Politik Handeln heute tagen Bundesrat Spitzenkraftwerken Vorschlag Wbf umsetzbar Uvek Berset Sommaruga Dfjpdfgp Dff
202,warum heute Tagesschau Helsinki Februar Bericht verstehen Finne belagern
203,Luxushotel Gstaad Woche Heizung ab Winterstromlücke Normalfall Bundesrat heute Spitzenkraftwerkvariante Wbf entscheiden Berset Sommaruga Dfjpdfgp Dff
204,Hujer Maass Langhans sicher kurios seit Zeit Lasinnen jedoch farbig Papier versenden heute February fallen Geld Porto weswegen Uhr Mez Ort Werdem
205,Guitar Walkingguitar ja klar i heute Februar Draussen Amp musizieren unterwegs Ontheroad besonders
206,alt reflektierend Ddr Plaste Verkehrszeichen Bild Parkverbot Usa heute verwendet
207,alt reflektierend Ddr Plaste Verkehrszeichen Bild Parkverbot Usa heute verwendet Zeichen r no Parking
208,Guitar Walkingguitar ja klar i heute Februar Draussen Amp musizieren unterwegs Ontheroad besonders
209,Guitar Walkingguitar ja klar i heute Februar Draussen Amp musizieren unterwegs Ontheroad besonders
210,wunderschön Wetter heute big b angenehm wenig Mensch sprechen außer Di
211,machen immer fassungslos militärisch Abschreckung statt diplomatisch Verhandlung anscheinend weit favorisiert Konzept Konflikt Russland Ukraine Ukrainekonflikt ukrainekrise Scholz Moskau heute Lanz
212,Walkingguitar ja klar i heute Februar Draussen Amp musizieren unterwegs Ontheroad besonders Lust to walken Amp play nachdem sehen i Djokovic Trend Hey Hvala i Tebi Nole Amp danken Ute Gitarre music rock Unplugged walknrocknroll live
213,Apexlegends Apex Coins Gaming Twitch Nurheute heute Gegenseitigeunterstützung Bhfyp Follow Ps Deutschland Alarm Callofdutywarzone Apexclips Gam
214,Flüchtling abschieben Bi Mülteci Sınırdışı Edilirken Stuttgarter Flughafen Bugün heute Stuttgart Havaalanı
215,heute Johann Heinrich Van eß Benediktiner nennen Leander übersetzen nt Vulgata populär griechisch Übersetzung Mischform Span complutensisch Polyglotte sowie Erasmus v Rotterdam At hebräisch Urtext erkennbar Jehova
216,Top Suchanfragen letzter h Abfahrt Dame K Olympia heute K Giovanni Zarrella K Abfahrt Dame Olympia heute Giovanni Zarrella
217,erster Höhepunkt kommend Sturmlage erwarten Donnerstag früh heute Wetter
218,Fc Bayer toll Mannschaft einfach genial Erfolg heute spielen viele grüßen Bastian d
