,Tweet_lemmatized
219,tja Kai fangen Gute gleich heute mal weniger Essen wegwerfen Gesetz dabei helfen Bewusstsein Einstellung Zukunft nächster Generation verbessern schon gewinnen
220,Mio Steuergeld Gratishäuslpapier heute sagen Geil Staubmaske Virus sitzen
221,io heute beim international Kinderkrebstag stehen jung Patientinnen Patient heldenhaft Kampf
222,damals Politiker außergewöhnlich Engagement Wissen Kompetenz empfohlen Qualifikation wa
223,Moi Leute Leutinnen viele bestimmen schon ahnen heute soweit starten letzter Stream heute freuen schon wünschen Wundervolle Zeit Dauersalzsendung
224,Lauterbach Höhepunkt Omikron Welle überschreiten Nachricht Meldung neu Wissen aktuell heute Corona Coronavirus Covid coronakrise Pandemie Deutschland Infektionszahl Lockerung Pcrtests Beschränkung
225,schon Römer nutzen mobil Klo Archäologie Geschichte Forschung Wissenschaft Nachricht Meldung neu Wissen aktuell heute Römer antik Sizilien Italien Hygiene
226,Querdenken Impfgegner täglich Arbeit Desinformation heute Impfschaden Kamera ganz klar sehen erwachen beweisen geben Zuhauf schon lange Impfstoff Jahr
227,Onlineabstimmung Impfpflicht Österreich Dztüber stimmen etwa dagegen Etw
228,Onlineabstimmung Impfpflicht Österreich Dztüber stimmen etwa dagegen Etw
229,heute beim international Kinderkrebstag stehen jung Patientinnen Patient heldenhaft Kampf Krebs Mittelpunkt unser Initiative Avatar möchten dabei unterstützen mehr erfahren
230,Mio Steuergeld Gratishäuslpapier heute sagen Geil Staubmaske Virus sitzen
231,Onlineabstimmung Impfpflicht Österreich Dztüber stimmen etwa dagegen Etw
232,Mio Steuergeld Gratishäuslpapier heute sagen Geil Staubmaske Virus sitzen
233,Onlineabstimmung Impfpflicht Österreich Dztüber stimmen etwa dagegen Etw
234,Mio Steuergeld Gratishäuslpapier heute sagen Geil Staubmaske Virus sitzen
235,Mio Steuergeld Gratishäuslpapier heute sagen Geil Staubmaske Virus sitzen
236,Mio Steuergeld Gratishäuslpapier heute sagen Geil Staubmaske Virus sitzen
237,Mio Steuergeld Gratishäuslpapier heute sagen Geil Staubmaske Virus sitzen
238,Onlineabstimmung Impfpflicht Österreich Dztüber stimmen etwa dagegen Etw
239,Onlineabstimmung Impfpflicht Österreich Dztüber stimmen etwa dagegen Etw
240,Onlineabstimmung Impfpflicht Österreich Dztüber stimmen etwa dagegen Etw
241,Onlineabstimmung Impfpflicht Österreich Dztüber stimmen etwa dagegen Etw
242,Onlineabstimmung Impfpflicht Österreich Dztüber stimmen etwa dagegen Etw
243,Onlineabstimmung Impfpflicht Österreich Dztüber stimmen etwa dagegen etwa dafür heute
244,klein verstrahlen Erinnerung Chernobylite Stream heute abend Twitchde
245,klein verstrahlen Erinnerung Chernobylite Stream heute abend Twitchde
246,klein verstrahlen Erinnerung Chernobylite Stream heute abend Twitchde
247,klein verstrahlen Erinnerung Chernobylite Stream heute abend Twitchde
248,Digitalennomaden Zypern Ciao Bello Wearenato Worldarmy Foxnews Cbsnews Forbes Nbcnews Nbc Cnn Usatoday Rtl Bild Cdu Nordrheinwestfalen Zdf Tagesschau Ard heute Heutejournal Tagesthemen
249,darling ja heute Nacht malen Sex möglich probieren
250,Trier heute abend überregional baführungskräfteaustausch aktuell Thema Grundsicherung Arbeitsmarkt
251,Ukraine Ciao Bellas Wearenato Worldarmy Foxnews Cbsnews Forbes Nbcnews Nbc Cnn Usatoday we Serve The World Rtl Bild Cdu Nordrheinwestfalen Cdu Paypal Spd Fdp Diegruenen Dielinke Afd Csu Zdf Tagesschau Ard heute Heutejournal Tagesthemen
252,Verwanzt Kupprionzalandoanderes Amp Quatsch klein Lady zurück
253,Wearenato Worldarmy Foxnews Cbsnews Forbes Nbcnews Nbc Cnn Usatoday we Serve The World Rtl Bild Cdu Nordrheinwestfalen Cdu Paypal Spd Fdp Diegruenen Dielinke Afd Csu Zdf Tagesschau Ard heute Heutejournal Tagesthemen
254,heute schon gut Tat absolvieren Handy Problem Tochter Fernwartung beheben
255,heute einfach mal scheinen wichtig
256,Mio Steuergeld Gratishäuslpapier heute sagen Geil Staubmaske Virus sitzen
257,Mio Steuergeld Gratishäuslpapier heute sagen Geil Staubmaske Virus sitzen Schreibstuben Msm
258,Freedomday heute statt gestern
259,heute Ehrentagdersingles Foto Wikipedia Infotweet
260,Fotovorschlag heute Kaffeepause
261,gut morgen Liebe Twitter Gemeinde wünschen toll Tag hoffen gehen gut Vater heute endlich wichtig Termin beim Arzt hoffen gut Plan heute Haus suchen haben planen Community
262,warum heute Tagesschau Helsinki Februar Bericht verstehen Finne belagern
263,warum heute Tagesschau Helsinki Februar Bericht verstehen Finne belagern
264,warum heute Tagesschau Helsinki Februar Bericht verstehen Finne belagern
265,my Form Schoolmate Heiko hebig Working At Facebook Hamburg oft Playing my doubeln Even munich to damögen my Reputation Ciao Bello verhaften Business Wearenato Rtl Bild Zdf Tagesschau Ard heute Heutejournal Tagesthemen
266,Gewissen Sfrage nich schaffen Icke heute Baumarkt Isses spät abend Brot vorbei Stunk Haus
267,Kriegsrhetorik heute Tagesschau aktuell Kamera ja fast Pazifismus Örr Zdf Ard Putin Ukraine Russia
268,Happy Birthday Josefhader Birthday Today heute Geburtstag Josef Hader Februar Waldhaus Strudengau oberösterreich österreichisch Kabarettist Schauspieler Autor Filmregisseur
269,Happy Birthday Hanskrankl Birthday Today heute Geburtstag Johann Hans Krankl Februar Wien ehemalig österreichisch Fußballspieler Popsänger
270,Happy Birthday Timbuckley Birthday Today heute Geburtstag Today Remember Eriinnerung Timothy Charles Buckley iii Februar Washington dc Juni Singersongwriter Usa
271,gt Screenshot gt bellowitsch Kratky Tgl ver Fake te Amp Trash Ijhgeäh Heuteat n immer besachwaltet Journaleninnen Amp Auhtoreninnen Ablichter Bieniek sehen
272,letzter heute Martin Mutschmann Plauener Spitzenmeister führen Ramscherkrieg Nsdapgauleiter Sachsen
273,Stuttgart heute Montagsdemo ab Uhr Online Prof dr Heiner Monheim Verkehrswissenschaftler Volker lösen
274,Wind nehmen schon heute Wetter
275,Vertreter kritisch Infrastruktur Ausbildungsberuf heute
276,wissen gerne mal wer immer Lockerung Corona Maßnahme rufen machen Angst heute
277,heute Fruehling finden
278,Pest wüten regional stark unterschiedlich Archäologie Geschichte Forschung Wissenschaft Nachricht Meldung neu Wissen aktuell heute Seuche Europa mittelalt Pandemie Medizin Mortalität
279,warum Deutschland Pandemie Dunkele tappen Nachricht Meldung neu Wissen aktuell heute Corona Coronavirus Covid coronakrise Pandemie Impfung impfen Deutschland Spahn Lockerung Omikron Impfstatus geimpft
280,Trier heute abend überregional baführungskräfteaustausch aktuell Thema Grundsicherung Arbeitsmarkt
281,heute abend überregional baführungskräfteaustausch aktuell Thema Grundsicherung Arbeitsmarkt Loerrach Bremen Berlin Frankfurt Dortmund Magdeburg Chemnitz Networking Leadership Jobcenter Arbeitsagentur Trier
282,heute Martin Mutschmann Plauener Spitzenmeister führen Ramscherkrieg Nsdapgauleiter Sachsen ab Mdr ab Reichsstatthalter Sachsen ab sächsisch Ministerpräsident offiziell Moskau erschießen Weib Minna Gulag
283,heute Georg Christian Füchsel Leibarzt Friedrich Karl Schwarzburgrudolstadt zeichnen geologisch Karte Johann gottlob Lehmann Mitbegründer Stratigraphie dh Bezeichnung Datierung Sedimentgestein benannt ua Muschelkalk
284,lesen Kind Menschheit früh spät eigen Dummheit Grund gehen
285,Trick it s Not A Trick it s A Sony eben Platztbuff haben löschen heute
286,Stuttgart heute Montagsdemo ab Uhr Online Prof dr Heiner Monheim Verkehrswissenschaftler Volker lösen
287,damals Politiker außergewöhnlich Engagement Wissen Kompetenz empfohlen Qualifikation wa
288,damals Politiker außergewöhnlich Engagement Wissen Kompetenz empfohlen Qualifikation wa
289,Lutherstadt Eisleben Kunst Kultur Kirche Evangelium Bildungsreise Mensch Geschichte Travel Travelphotography Reiselust Entwicklung heute morgen Daslebenistschön Daslebengenieß Eisleben Lutherstadt
290,Stuttgart heute Montagsdemo ab Uhr Online Prof dr Heiner Monheim Verkehrswissenschaftler Volker lösen
291,Stuttgart heute Montagsdemo ab Uhr Online Prof dr Heiner Monheim Verkehrswissenschaftler Volker lösen
292,Stuttgart heute Montagsdemo ab Uhr Online Prof dr Heiner Monheim Verkehrswissenschaftler Volker löschen Theaterregisseur Stuttgart s Deutschebahn Bahn Verkehr Verkehrswende Klima Klimaschutz Klimawandel Fridaysforfuture
293,bleiben Woche basta Frankfurt starten bleiben mehr Zeit Ticket besorgen basta teilnehmen sein schlau holen Ticket heute Ticket gibts Gtgt
294,Facebook Hamburg with Well Dose Neuton Bombs Rtl Bild Zdf Tagesschau Ard heute Heutejournal Tagesthemen
295,Whatapp Instagram Facebook Serious hacken Some Of my Girls Got Even Herrassed Because Of this Stasi Gestapo Nazisraus Usarmy Intelligence Not Stupidity Wearenato we Serve The World Rtl Bild Zdf Tagesschau Ard heute Heutejournal Tagesthemen
296,Whatapp Instagram Facebook Serious hacken Some Of my Girls Got Even Herrassed Because Of this Stasi Gestapo Nazisraus Usarmy Intelligence Not Stupidity Wearenato Worldarmy Foxnews Cbsnews Forbes Nbcnews Nbc Cnn Usatoday Rtl Bild Zdf Tagesschau heute
297,damals Politiker außergewöhnlich Engagement Wissen Kompetenz empfohlen Qualifikation möglich heute genügend auffallen nötig Aufmerksamkeit erlangen unqualifiziert hoch politisch Amt langen
298,Isking neu Woche starten heute wittlich gesund erfolgreich Wochenstart schön Valentin
299,neu Woche starten heute wittlich gesund erfolgreich Wochenstart schön Valentinstag Mondaymotivation Monday Goodmorningtwitterworld Goodmorning Trier work Zitat Quote Valentinesday Valentinstag springen
300,Bund schämen einfach Bund fühlen deutsch Bürger erwünschen Heimatland damals heute Geschichte Monodemokratie
301,einzig Kind Designatedsurvivor Of germany Nazi Stasi Gestapo Usarmy Usarmyintelligenceandsecurity Not Stupidity Bamad Wearenato Worldarmy Foxnews Cbsnews Forbes Nbcnews Nbc Cnn Usatoday Rtl Bild Zdf Tagesschau Ard heute
302,gut Mettbrötchentag heute wichtig Leck
303,Happy Valentinesday Sorry its only Worldpeace Wearenato Worldarmy Foxnews Cbsnews Forbes Nbcnews Nbc Cnn Usatoday we Serve The World Rtl Bild Zdf Tagesschau Ard heute Heutejournal Tagesthemen
304,Happy Valentinesday Sorry its only Worldpeace Wearenato Worldarmy Foxnews Cbsnews Forbes Nbcnews Nbc Cnn Usatoday we Serve The World Rtl Bild Zdf Tagesschau Ard heute Heutejournal Tagesthemen
305,heute Valentinstag karlsruher Blumenläden bekommen hierfür schön Rosen Sträuße Meinka Karlsruhe Geschäft Floristik Rose Strauß pflanzen Blume Blume
306,Lmu Muenchen Bayern Richthofen Foreignlegion Usarmy Wearenato Worldarmy Foxnews Cbsnews Forbes Nbcnews Nbc Cnn Usatoday we Serve The World Rtl Bild Zdf Tagesschau Ard heute Heutejournal Tagesthemen
307,melden machen frei Z b Zombies Dämon Wearenato Worldarmy Foxnews Cbsnews Forbes Nbcnews Nbc Cnn Usatoday we Serve The World Rtl Bild Zdf Tagesschau Ard heute Heutejournal Tagesthemen
308,wundern immer Zdfmagazin Faktensicherer Bericht Polittalk h
309,wundern immer Zdfmagazin Faktensicherer Bericht Polittalk h
310,Kaiserwetter heute
311,heute Thies Christophersen frontuntauglich Löwenzahnzüchter Auschwitz d Landwirt geben ua deutsch Bauer Bauernschaft Recht Gerechtigkeit heraus veröffentlichen Auschwitzlüge werden heikel Versandhandel Nordwind Zeuge Zündelprozeß
312,Steinmeier Gegner Lachen ja Huhn Dampfplauderer heute Zdf
313,wundern immer Zdfmagazin Faktensicherer Bericht Polittalk heute andererseits Realität Corona Satire
314,Command to Nuclear Force Wearenato Worldarmy Foxnews Cbsnews Forbes Nbcnews Nbc Cnn Usatoday we Serve The World Rtl Bild Cdu Nordrheinwestfalen Cdu Paypal Spd Fdp Diegruenen Dielinke Afd Csu Zdf Tagesschau Ard heute Heutejournal Tagesthemen
315,Spaziergang Stadtpark Anklam aktuell heute Anklam Stadtpark Park Spaziergang spazieren Mecklenburgvorpommern mv Mvtutgut Smartphone Handy Handyfotografie Handyfoto Cubot music Echo
316,Spaziergang Stadtpark Anklam aktuell heute Anklam Stadtpark Park Spaziergang spazieren Mecklenburgvorpommern mv Mvtutgut Smartphone Handy Handyfotografie Handyfoto Cubot music Echo
317,best Scheissße neu soeben wg heute Rechnung sagen polnisch Waitress grüßen Chef haben
318,heute hassen direkt aufwachen fotografieren Mensch lachen Dogsoftwitter Twitterrudel
319,Langeweile sollen zwei Neunjährige Düren mehr Auto zerkratzen mehrere Tausend Euro Schaden schätzen alt fordern Amp Eigentum Zerstören Jugend heute
320,bitte Faktencheck warum hören darüber zwangsfinanziert dt Medium Rnd Nzz Tagesschau heute Phoenix Reuters Dpa Bundestag Bundesregierung Cdu Csu Afd Fdp Spd Tagesthemen Annewill Lanz Corona Lauterbachmussweg Rechtsbeugung Bundesvesammlung
321,wunderschön Wetter heute big b angenehm wenig Mensch sprechen außer müssen wegen wieso heute ausgesprochen schön Wetter Berlin Sleep Well
322,fehlen heute coretweets Amp stellen Fr
323,Mode Frau heute Frau Frau heute
324,gut deutsch Eingefalleverschlußz heute wg Amp zahlen via Pay Neincommunication
325,gut deutsch heute Montag or Sunday February Sleep Well
326,heute abends beim beim Training heute auffallen Sporttasche groß aussehen mal Inhalt Tasche reduzieren machen mitnehmen Frage Alltag Training
327,Baerbock immer Fehlerfrei sprechen peinlich heute
328,Morddrohung Karllauterbach Wearenato Worldarmy Foxnews Cbsnews Forbes Nbcnews Nbc Cnn Usatoday we Serve The World Rtl Bild Cdu Nordrheinwestfalen Cdu Paypal Spd Fdp Diegruenen Dielinke Afd Csu Zdf Tagesschau Ard heute Heutejournal Tagesthemen
329,Wearenato Worldarmy Foxnews Cbsnews Forbes Nbcnews Nbc Cnn Usatoday we Serve The World Rtl Bild Cdu Nordrheinwestfalen Cdu Paypal Spd Fdp Diegruenen Dielinke Afd Csu Zdf Tagesschau Ard heute Heutejournal Tagesthemen
330,Command to Army Of Ukraine For Worldpeace Wearenato Worldarmy Foxnews Cbsnews Forbes Nbcnews Nbc Cnn Usatoday we Serve The World Rtl Bild Zdf Tagesschau Ard heute Heutejournal Tagesthemen
331,Command to Russian Army Wearenato Worldarmy Foxnews Cbsnews Forbes Nbcnews Nbc Cnn Usatoday we Serve The World Rtl Bild Zdf Tagesschau Ard heute Heutejournal Tagesthemen
332,Terror Türkei stolz Türke sunnitisch Akptreu heute bewaffnet Angriff
333,Terror Türkei stolz Türke sunnitisch Akptreu heute bewaffnet Angriff
334,Terror Türkei stolz Türke sunnitisch Akptreu heute bewaffnet Angriff alevitisch Gebetshaus Rassismus Staatsterror Net
335,Österreich Sonnenschein nochmal Glück haben heute Wetter
336,brauchen Freedomday sobald möglich nie Lockdown nie Impfzwang Impfpflicht Freiheit heute Freedomconvoy
337,Kopf Herz wovon Herz voll davon reden Mund Matthäus Kind Blitz Palme heute Baum Leben Verantwortung Jesus
338,heute Philipp Friedrich Alexander Graf Eulenburg Soldat dt Krieg Dtfranz Ek studieren Jura schreiben Rosenlieder ab Diplomat Bismarck Schwärmer Spiritist Romantisierender Schönredner liebenberg Kreis Bro v Wilhelm ii
339,letzter heute Jahr finden Uraufführung Volkshymne Komponist Joseph Haydn Gen Kaiserlied Text Lorenz Leopo
340,heute Jahr finden Uraufführung Volkshymne Komponist Joseph Haydn Gen Kaiserlied Text Lorenz Leopold Haschka Wien statt Zweck Stärkung Kronlande Koalitionskrieg u Gegenentwurf Marseillaise Heil Siegerkranz
341,Hamburg heute Viburnum Schneeball
342,Hamburg heute Prairiegrass
343,Hamburg heute Helleborus
344,Hamburg heute Snowdrop
345,Last Rear up Of east German Spy no guns But Good At Psychoterror Wearenato Worldarmy Foxnews Cbsnews Forbes Nbcnews Nbc Cnn Usatoday Rtl Bild Zdf Tagesschau Ard heute Heutejournal Tagesthemen
346,Asmileaday heute zwei Probe schnell Espresso Liebe sonnenbeschienen Terasse Flöte Flötenliteratur Flötistenalltag Flötenmusik Klassik Klassischemusik
347,stecken Lebenszeit drinnen unzählig klein Stich Hermann Staudinger aktuell Ausstellung Staudingers Werk laufen Ende kommend Woche kommen Gute heute vorbei mehr Amart
348,heute folgend Vorschlag Fotovorschlag Katze Caturday
349,my Opinion Spschweiz Defines The Term Retarded Quite Well en Retard gut Delayed verspätet Scusateilritardo wdh entschuldigen Verspätung entschuldigen Idiot heute Helium Luft blasen schönreden
350,q Qanon Stasi Easterling Spy Wearenato Worldarmy Foxnews Cbsnews Forbes Nbcnews Nbc Cnn Usatoday Rtl Bild Cdu Nordrheinwestfalen Cdu Paypal Spd Fdp Diegruenen Dielinke Afd Csu Zdf Tagesschau Ard heute Heutejournal Tagesthemen
351,heute Mensch Uhr schlafen Couch übernachten unser Kuscheldecke Aufstehgesicht unser Knuddelrunde Dogsoftwitter Twitterrudel
352,Kuenstler heute weltweit Plumpuddingtag zelibriert Tag natürlich perfekt Gelegenheit en
353,heute weltweit Plumpuddingtag zelibriert Tag natürlich perfekt Gelegenheit endlich mal erstmalig Leckeren Plumpudding Essen Infotweet
