,Tweet_lemmatized
0,danken Merkel
1,These De bitte Vergessen wer Amt hieven Ausgleich dafür Kommisionspräsident De kommen gehen Axel Weber Chef Ezb leer kommen dafür Christine Lagarde zwei Nieten klappen danken Fr Merkel
2,danken Merkel
3,Saar Vergessen Leute gerne Jahr Merkel möglich Linksruck Schranke weisen danken cuckservativ
4,Ntv voll Grünkirs d Waffe persönlich Verteidigung Clan Maffia u A Waffe Bürger bewissen Unbewaffnetpolitik Gewolltwehrpflicht aussetzen hilflos machen danken Fr Merkel
5,Wolfgang danken Korrektur
6,Karlsruhe tja haben danken Frau Merkel Wahl wegweisend Epochal Jahr fassungslos zurückblicken
7,gar belangen rum Bratwurstscholz en ne ruhig Kugel schieben Raute Grauen Wirschaffendas Euro Steuerzahlergeld Pension gehen Sintflut werden Merkel jemals belangen nein danken dt Michel
8,danken Merkel
9,danken Frau Merkel schaffen Vermächtnis können eigen Volk antun kriminell Gesindel Fraß vorwerfen hoffentlich bekommen Gerechte Strafe dafür
10,Mucnord jung Union danken Verdeutlichung Jahr Union Regierung Jahr K
11,Union danken Merkel
12,Dreckloch Berlin Gewalt Highdecksiedlung Mob attackieren Auto bitte meiden Nogo Area Berlin
13,brutal Gewalt durchziehen vornehmen danken Merkel
14,danken Merkel Jahr verwaltet
15,danken Eu danken Euro danken Merkel
16,impfen geboostert sowie danken Merkel Profil wandelnd Clownklischee
17,danken Eu danken Euro danken Merkel
18,Frau Merkel Frau Position bringen sagen mal schön danken Frau Merkel
19,Dreckloch Berlin Gewalt Highdecksiedlung Mob attackieren Auto bitte meiden Nogo Area Berlin Neukölln danken Cdu Spd Fdp Linke Grüne Frau Merkel gt Berlin Wien Flüchtling Islam
20,Innenstadt Heimatstadt laufen kommen sein entweder Türkei irgendwo Afrika landen schön Stadt Jugend rein gar mehr Tun danken Merkel f
21,danken Merkel gehören hinten dran
22,danken Wolfgang
23,danken Merkel
24,Zuschauer Plus Klatschpappen danken Merkel Effzeh Koesge
25,germany is Truly The Kremlin s Trojan Horse Nato danken Merkel
26,danken Wolfgang
27,danken Merkel
28,danken Merkel
29,Frau Angela Merkel Baerbock lang danken nein
30,gut minen danken tief leider gehen groß Freiheitsbedürfnis Schrottpolitologen lehren lassen u Hervorgebracht sehen Merkel Bill Misswirtschaft
31,danken Frau Merkel
32,Dersommer Friedrichmerz nennen naiv Merz Merkel Klatschpappen Opportunist Rücken nein danken Amt lassen erst Situation manövrieren
33,akademisch Ausbildung erlauben selbstbestimmt eigenverantwortlich Leben Stellige Steuerbeitrag zahlen engagieren Z Nachhilfe Flüchtling danken Merkel asozial G G Impfplicht Mensch Nazisraus haben Vergessen
34,sagen bitte neu Info Merkel Gmbh haben danken
35,Recht Merkel Kür Wulff wissen Genugtuung Hand reiben Wahlgang lebend Bundespräsident aktuell danken Merkel
36,danken Wolfgang
37,mk sofortig Verzicht komplett Co Ausstoß Verkehr Industrie Heizung vielleich
38,danken Merkel
39,danken Wolfgang
40,Statistik Kaže Str Porast Primerov ko Bili Ljudje Porinjeni na Tračnice v Nemčiji danken Mutti Merkel Različnost Na Bogati
41,schön Pflaumbaum Rip sollen Punk Kohle Frage danken Merkel
42,danken Merkel
43,richtig Regel viele eben mehr Leben danken Angela Merkel
44,danken Merkel werden danken Baerbock warum danken Scholz
45,Dorn Rudolf Thanks Obama Amp danken Merkel Hessen Edition bekommen
46,danken Frmerkel ew Ausstieg ke Studie Uwsj teuer Udümmste Energieuks Politik d Oecd Staat Ampel Zeit Inflation Umehr Inflationkrieg wenigstens Glversdie Kkwe nutzen
47,Top danken Herr Schuller Text Bestenzeit substantiell Faz Analyse anknüpfen gleichzeitig Urteil ub Merkelschröder Putinpolitik Beteiligt Steinmeier etc ausgesprochen
48,Weidel Nee müssen lieber Alice Weidel wissen sagen intelligent Merkel Qualle formen Gute passen Nee danken
49,danken Merkel
50,Speisewagen dürfen immer Snickers Essen danken Merkel Nichtmeinland Warumruftkeinederprak
51,danken Merkel Wettermaschine rumdrehen müssen
52,Orr mal mehr Tran Person hetzen Afd Meinung Partei Bundestag Haltung scharf kritisieren Recht Ecke stellen echt gemein danken Merkel
53,Koenigin Jahr Advent Februar danken Merkel
54,Jahr Advent Februar danken Merkel
55,Februar Weihnachtsgeschenk kaufen danken Merkel
56,mk sofortig Verzicht komplett Co Ausstoß Verkehr Industrie Heizung vielleicht Status quo erreichen Wetterkapriolen sicher bleiben schon spät danken Merkel
57,danken Wolfgang
58,danken Überboss nfts helfen Merkel Dkiktatur Maulkörben
59,danken Wolfgang
60,haben Abrissbirne Angela Merkel rechtzeitig Ddr zurück schicken sein passieren danken Baden ja
61,danken Merkel
62,Fraktur danken Gerhard Schröder journalistisch Bullshit Merkel ganz Mist Unfähigkeit herbeifgeführt deutsch Rußlandhassern machen Hitler schon Ergebnis sehen
63,danken Merkel
64,danken Merkel
65,danken Merkel
66,danken Merkel
67,danken Merkel
68,Speisewagen dürfen immer Snickers Essen danken Merkel Nichtmeinland Warumruftkeinederpraktikantinnenmehrzurück Ichstehvormkadeweundmerkewiearbeitslosichbin
69,danken Merkel
70,danken Frau Merkel
71,Ziesmann Schallenberg Baerbock herzlich dank Herr Strache wichtig fehlen vo
72,Mucnord jung Union danken Verdeutlichung Jahr Union Regierung Jahr Kanzler Merkel dafür tun deutsch Verbraucher ausquetschen heute dank Folgerung lauten nie Union wählen
73,danken Merkel Wolfgang
74,Geburtsdatum Dekade genügen Beginn hartzens Photo Gadse danken Merkel Ende Vergessen
75,Wolfgang danken
76,Net danken Frau Merkel toll Idee Energieversorgung Hand Kreml legen no
77,Piet nix Kannste mehr verlassen danken Merkel
78,S danken Merkel
79,Leh danken Merkel
80,danken Merkel Wolfgang
81,Terroranschlag Hagen planen Syrer Oday Synagoge angreifen Anleitung Bombenbau Sprengstoffgürtel bereits danken Cdu Spd Fdp Linke Grüne Frau Merkel gt Berlin Wien Flüchtling Islam
82,Shaice Gelumpe mal neu starten hängen immer G rum danken Merkel
83,danken Frau Merkel
84,Wolfgang Merkel liegen schon Jahr Schreibtisch danken Merkel
85,danken mama Merkel genießen ungeniert sorglos Rente unzählig Leibwächter fahren schnellstens Hölle
86,Ziesmann Schallenberg Baerbock herzlich dank Herr Strache wichtig fehlen vo
87,danken Merkel
88,danken Frau Merkel
89,Uhr hören Pachelbel danken Merkel
90,Before naiv Thought germany is A Great country And Merkel is A Great Leader Next year danken Frau Ribbentrop
91,Ziesmann Schallenberg Baerbock herzlich dank Herr Strache wichtig fehlen vo
92,Ziesmann Schallenberg Baerbock herzlich dank Herr Strache wichtig fehlen Schallenberg danken Frau Merkel
93,Schijunior danken Merkel
94,Roettgen danken schaden klar Wort nie regierend Spd hören hoffentlich Cdu w
95,Berset groß Fehlentscheid Korrigierenshangela Merkel Osterruhezeigen Potenzial lernen danken
96,danken Merkel
97,Roettgen danken schaden klar Wort nie regierend Spd hören hoffentlich Cdu Wort Wiederholen Cdu regieren Merkel Ukraine Georgien Natobeitritt torpedieren
98,danken Frau Merkel
99,danken Frau Merkel
100,danken Merkel Wolfgang
101,danken Merkel
102,hc Strache danken Frau Merkel
103,danken Frau Merkel
104,danken Merkel
105,danken Merkel
106,mieten einfach hoch danken Frau Merkel
107,ja danken Merkel
108,danken Merkel mehr Wort
109,danken Merkel mehr Wort
110,Bernd f gerne all Geld Konto holen Automat weigern auszahlen danken Merkel
111,Geld haben Schallenberg danken Herr Strache bitte Frau Merkel antworten haben Blitzbirne Baerbock bemerken
112,danken Merkel
113,Bryant danken Merkel
114,ukrainekrise eskalieren schlimm gut T Russ Soldat Amp Eskalation Donbas bitte schicken Frau Merkel Verhandlerin Putin wissen Gute Chaot umgehen danken
115,Winwinwin werden sagen danken Merkel
116,Fala vi A i danken Tetka Merkel
117,brok Thank you Father Kim Ilsung Woke danken Mutti Merkel
118,danken Merkel
119,danken Frau Merkel
120,danken nachvollziehen ähneln gewissermaßen Merkel zeitweise Diskussion laufen lassen Ding erst Ende entscheiden Corona Merkel Entscheidungsfreudiger vermutlich sehen viele Bürger ähnlich zeitweise Trendete ja Woistscholz
121,danken Merkel
122,danken Merkel
123,danken Merkelelf
124,danken Merkel
125,Christ souverän wer Ausnahmezustand entscheiden danken Merkel
126,danken Merkel
127,danken Frau Merkel Randale Jena Sek Verhaftet Krawallsyrer
128,roehn Denkminderleister Querdenken reaktionär Labermedien deren Dunstkreis Nerv danken Merkel danken Ampel
129,Aktie Arm machen danken Merkel
130,danken Merkel danken Grüne
131,Bu Fırtınada Araba Sürmek danken Merkel
132,Emerald Einrichtung Art Aufwandsentschädigung Mehraufwand Leute meckern haben wählen De Zuagroasten Kosten Steuerzahler jährlich bald Mrd dh seit ren Mrd danken Frau Merkel schaffen schaffen Merci
133,dank Maßnahme befürchtet Erdbeben kommen danken Merkel
134,danken Merkel
135,Freiheit Leben System unterwerfen danken Merkel äh Scholz
136,danken Frau Merkel
137,Sun danken Merkel
138,führen geradewegs Abgrund danken Merkel Merz bieten Hoffnung
139,Skandal danken Merkel
140,danken Merkel Windrad
141,danken Merkel Windrad
142,Strom fallen Heizung ebenfalls stehen Land still danken Jahr Merkel Honecker Rache grün freuen klammheimlich sowie Tritt damals
143,Zensur brutal sogar Twitter Sekundenwerbespot Gettr hochladen dürfen danken Merkel
144,danken sein Artikel
145,entscheidend Ursache Frauentötung liegen sagen danken Frau Merkel
146,danken Merkel
147,Boooaaahhhh danken Merkel
148,danken Frau Merkel
149,bohl eben wissen Droetkerwelt geben unbedingt danken Merkel
150,Forum wissen genau Schreibweise mehr deshalb Schreibweise dürfen mehr sagen danken Merkel
151,danken Frau Merkel
152,danken Frau Merkel
153,danken Merkel
154,Zensur brutal sogar Twitter Sekundenwerbespot Gettr hochladen dürfen danken Merkel
155,deswegen sagen danken Merkel
156,danken Scholz einfach selber Bums danken Merkel schaden
157,Zensur brutal sogar Twitter Sekundenwerbespot Gettr hochladen dürfen danken Merkel
158,Zensur brutal sogar Twitter Sekundenwerbespot Gettr hochladen dürfen danken Merkel elf Reitschuster
159,warten seit Stunde Essen Lieferando danken Merkel
160,danken Frau Merkel
161,heute hübsch jung Mädchen Abiabschluss coachen leidenschaftlich Lastenrad rummachen kommen Polizei wegen Verführung minderjährig Festgenommen G wohl toll Idee danken Merkel
162,Bjorn danken sinnvoll Einwand Mensch meistens grundverschieden nehmen mal beide Banalität Nachdenken Merkel übrigens explizit Beschränkung Kanzlerschaft ausgesprochen sagen
163,danken Merkel
164,Au danken Merkel
165,Neuvertrag Region Cent Kwh Strom Gas Steigerung Sommer Cent Kwh Cent Kwh Gas danken Angela Merkel Niewiedercdu
166,danken Merkel
167,genau danken Merkel
168,Einzelfall knapp ckwh danken Merkel danken Gruenen
169,Nahori Merkel gibts mehr finden Slogan danken Ampel gut xd
170,Harfreisbarthler Bundesverfassungsgericht werden Greatreset kapern danken Merkel
171,danken Merkel
172,Politiker gerade Deutschland ausversehen rund danken Merkel dafür bestimmen
173,Ausost berichten darüber na ja Wunder ja tot danken Merkel
174,danken Merkel
175,sk danken Merkel
176,sk Velazquez E eben warum bereiten Staat ordentlich Spaziergang danken Merkel
177,Harfreisbarthler Bundesverfassungsgericht werden Greatreset kapern danken Merkel
178,danken Schroeder ex Kanzler sitzen Aufsichtsrat Grössten Gasunternehmen Welt Konzern fürstlich bezahlen machen Lobbyarbeit Brdeuropa mal nachmachen dagegen verblassen sogar J Merkelregierung Typ echt Fuchs
179,richtig Merkel weniger Kind Covid Erkrankt danken Ampel danken Fdp
180,fallen Ein danken Merkel dafür Geld
181,Harfreisbarthler Bundesverfassungsgericht werden Greatreset kapern danken Merkel
182,danken Merkel
183,gewiß Schlaganfall Impfung Schuld danken Merkel
184,Kater Arbeit fahren danken Merkel
185,Hallo Angela Merkel wissen Rente brauchen bitte geben G danken
186,Hallo Angela Merkel wissen Rente brauchen bitte geben G danken
187,danken Merkel
188,danken Hinweis wobei Nazibeschuldigung Stgb stellen Naziverbrechen
189,danken Merkel äh Olaf
190,Les Atlantistes Nauront Pas Leur Guerre Portée Chez Les Autre Et Tant Espérée par Les Analphabètes Politiques Fallait Choisir Lukraine Dans Lotanne ou La Russie Et Le Butane Grâce à Merkel danken Mutti Cest La Seconde Option Choisie
191,wem Vorschlag kommen ja eigentlich egal Gespräch Davidmcallister Daz
192,danken Merkel Faeser Enters The Room
193,wem Vorschlag kommen ja eigentlich egal Gespräch Davidmcallister äußern möchten danken Demoderator Merkel Scholz Putin
194,sagen mittlerweile schon danken Scholz danken Merkel ja falsch echaufieren
195,Frau Merkel Deutschland Gnadenstoß geben nein danken Jahr Talfahrt genügen
196,Harfreisbarthler Bundesverfassungsgericht werden Greatreset kapern danken Merkel
197,Zensur danken Merkel
198,Covid machen Trennung eigen ex Mann verarbeiten danken äh Merkel
199,Wait Youre Telling me That i need to Get Every Dragon stylen Upgrade to Get The Last Battle with Majima danken Merkel
200,heute Böllern danken Merkel
201,Dudek dank Merkel werden Natoperspektive Georgien Ukraine Natogipfel Bucharest Jahr ausschließen paar Monat spät Griff Russland zuerst Georgien danach Ukraine danken Merkel
202,danken Merkel
203,danken Hinweis wobei Nazibeschuldigung Stgb stellen Naziverbrechen Generation relativieren vd Politik benutzen nazivergleich bewirken it tr gr schon Merkel Nazi karikieren gr
204,erben einfach mehr Moment danken Merkel
205,danken Merkel
206,danken Merkeldanke Redingdanke Deuschland Pomozite Domovini Hrvata Dovršiti Oluju Kako Valja
207,Dit is Deutschland danken Merkel
208,verdient Applaus Bundesversammlung Bundeskanzlerin Angela Merkel danken Frau Präsidentin
209,möchten Angela Merkel Kraft Umsicht danken Deutschland letzter Jahr wahren
210,erst Tag Amt danken Groko Merkel immer hervorragend laufen
211,danken Merkel
212,erst Tag Amt danken Groko Merkel immer hervorragend laufen
213,Duckmäusertum gegenüber Russland nie verstehen Russland deutsch Exportwirtschaft fast schon unbedeutend exportieren Polen fast dreifach Ungarn fast Genausoviel Gas womit Ei danken Merkel
214,Tag haben gut Anfang erst vorwerfen Sache kümmern benutzen irgendeine Terf Scheiße lesen danken Merkel
215,danken Deutschland Merkel gestartet Totalitarismus Faschismus führen schon lange mehr immer mal neu
216,heute dürfen danken Merkel sagen schließlich
217,Ostmann Friedrichmerz Merkel dafür sorgen Friedrichmerz nie Kanzler danken Frau Merkel dafür Friedrichmerz
218,danken Merkel
219,Obj Verletzt danken Merkel
220,Deutschland Zukunft danken Merkel grün rot geben Rest arm Deutschland Wunder immer mehr deutsch auswandern überwiegend Arzt Amp Ingenieur
221,danken Merkel
222,i think The Honor go to Merkel She Allowed to walken Away as if Some ub Woman Who Kept Russia At Bay But this Situation is her True Legacy danken Frau Ribbentrop
223,Eu Regierung Merkel Menschenleben Gefahr bringen Achso hereinholen diverser Messermänner Terrorist danken Erinnerung
224,Merkel vorgetragen fast unmöglich Fall wissen Tat Präsentation Hymne Gg danken Merkel
225,danken Frau Merkel
226,kaum einzig Club ewig Verlierer verlassen vormachen viele folgen danken Merkel
227,verdient Applaus Bundesversammlung Bundeskanzlerin Angela Merkel danken Frau Präsidentin
228,bemerkenswert sogar Sprache Begrifflichkeit gleich danken Merkel
229,danken Merkel
230,bemerkenswert sogar Sprache Begrifflichkeit gleich danken Merkel
231,warten seit Stunde Essen Lieferando danken Merkel
232,Messlatte hoch heutig Tag zeigen wer Star Merkel bitte zeigen morgen heißen Kanzler danken voraus
233,w Rosja Zajęła Krym i Nic Rosja Zabierze Sobie Dalszy Kawałek Ukrainy i Zapyta nie Mamy Waszego Płaszcza i Co Nam Zrobicie
234,w Rosja Zajęła Krym i Nic Rosja Zabierze Sobie Dalszy Kawałek Ukrainy i Zapyta nie Mamy Waszego Płaszcza i Co Nam Zrobicie
235,w Rosja Zajęła Krym i Nic Rosja Zabierze Sobie Dalszy Kawałek Ukrainy i Zapyta nie Mamy Waszego Płaszcza i Co Nam Zrobicie
236,w Rosja Zajęła Krym i Nic Rosja Zabierze Sobie Dalszy Kawałek Ukrainy i Zapyta nie Mamy Waszego Płaszcza i Co Nam Zrobicie
237,Friedrichmerz danken Offenheit zeigen Restwähler eindeutig kaputt u J merken
238,w Rosja Zajęła Krym i Nic Rosja Zabierze Sobie Dalszy Kawałek Ukrainy i Zapyta nie Mamy Waszego Płaszcza i Co Nam Zrobicie
239,w Rosja Zajęła Krym i Nic Rosja Zabierze Sobie Dalszy Kawałek Ukrainy i Zapyta nie Mamy Waszego Płaszcza i Co Nam Zrobicie
240,w Rosja Zajęła Krym i Nic Rosja Zabierze Sobie Dalszy Kawałek Ukrainy i Zapyta nie Mamy Waszego Płaszcza i Co Nam Zrobicie
241,w Rosja Zajęła Krym i Nic Rosja Zabierze Sobie Dalszy Kawałek Ukrainy i Zapyta nie Mamy Waszego Płaszcza i Co Nam Zrobicie
242,Rosja Zajęła Krym i Nic Rosja Zabierze Sobie Dalszy Kawałek Ukrainy i Zapyta nie Mamy Waszego Płaszcza i Co Nam Zrobicie Nic bo Przecież Rosja Ma Gaz danken Frau Merkel
243,Friedrichmerz danken Offenheit zeigen Restwähler eindeutig kaputt u J merken
244,danken Merkel
245,danken Frau Merkel
246,schwer nächster Kanzler Fußstapfen treten danken Frau Merkel
247,Muddi is danken Merkel
248,Muddi is danken Merkel
249,danken Merkel
250,Muddi is danken Merkel
251,verdient Applaus Bundesversammlung Bundeskanzlerin Angela Merkel danken Frau Präsidentin
252,Muddi is danken Merkel
253,verdient Applaus Bundesversammlung Bundeskanzlerin Angela Merkel danken Frau Präsidentin
254,Ostmann Friedrichmerz Merkel dafür sorgen Friedrichmerz nie Kanzler danken Frau Merkel dafür Friedrichmerz
255,verdient Applaus Bundesversammlung Bundeskanzlerin Angela Merkel danken Frau Präsidentin
256,verdient Applaus Bundesversammlung Bundeskanzlerin Angela Merkel danken Frau Präsidentin
257,Friedrichmerz danken Offenheit zeigen Restwähler eindeutig kaputt u J Merkel heute wirklich werden Jahr schlechtern Bundespräsident Steinmeier Erinnern Tweet zeigen versagen Cdu Schande
258,Ostmann Friedrichmerz Merkel dafür sorgen Friedrichmerz nie Kanzler danken Frau Merkel dafür Friedrichmerz
259,Friedrichmerz Merkel dafür sorgen Friedrichmerz nie Kanzler danken Frau Merkel dafür Friedrichmerz eigen Persönlichkeit Beitrag heute Beweis dafür
260,danken Böhmermannmerkel
261,reuen zuletzt Brücke Union Spd weitere Merkelamtszeit einbrocken danken vier weitere Jahr Stillstand
262,Nater ev danken Merkel
263,danken Cdu Spd Fdp Linke Grüne Frau Merkel gt Berlin Wien Flüchtling Islam
264,Punkt Qual cool danken Merkel
265,Saegge Petition danken Merkel danken Saegge ersetzen
266,Saegge Petition danken Merkel danken Saegge ersetzen
267,danken Frau Merkel schaffen
268,sagen danken Merkel
269,Bloss Durchblick Notbremse ziehen haben früh bremsen danken Merkel Teuere Strom stimmen privat Endkunden dafür tragen Cdu Verantwortung
270,Moi Herr Borbe bleiben Merkel Zverstörte Friedrichmerz Einechance ändern ansonsten sagen danken Cdu ermöglichen danken Satire deligiert
271,danken Frau Merkel schaffen
272,iz Kiz danken Merkel Official Video prod by Drunken Master
273,danken Bild extra abonnieren möglichst Merkel erfahren
274,schon Brettspielanleitung gegendert Skandal danken Merkel
275,ja endlich Hillary Clinton Krieg ja schon Jahr Trump Merkel Biden endlich umsetzen groß danken Frau Baerbock außerordentlich diplomatisch Fähigkeit
276,Merkel Cdu völlig links abgedriftet Z Russlandpolitik Spezi Barroso Rasmussen Europa Rand Krieg führen nein danken Niemehr
277,danken Merkel Regierung
278,danken Merkel ja mehr sagen
279,wann kommen Argument Sinn machen Blutdrucktablette sogar täglich nehmen danken Merkel echt he
