,Tweet_lemmatized
356,Matthäus neuerdings Berater Süle irgendwie verbandeln fressen Süle Transfer
357,Fehled definitiv paar Grillz Ide fressen
358,brauchen Pflicht komisch Schweden freiwillig Lappen
359,ach Gott Diesewir befragen üblich Leute Online per Telefon Gesteuertenfr
360,Lauterbach halten bitte endlich widerlich verlogen hetzend fressen lassen einweisen
361,immer sein Impfpflicht Impfzwang fressen gehen Birne
362,haben haben Fixkosten Freizeit jung knapp Monat einfach vermögen
363,Schwurblerine warum tragen Maske wollen Gesicht zeigen nein hässlich fressen wollen garantieren sehen schwören
364,wegen Polizeiproblem Rumheulen Abstandsholz dazwischen passen gibts Schlagstock Di
365,Fc ehrlich Wissen wer Hirn Geschissen uneinsichtig Scheiße Laber sagen hoffen steigen ab geben viele gut Halt fressen Verpiss Account
366,haben haben Fixkosten Freizeit jung knapp Monat einfach Vermögen aufbauen ja fressen Geld haben ja viele Mensch Leben Armut
367,Auge verdienen seit Jahr ne groß fressen langfristig immer champions League spielen Krieg mal Bundesliga etablieren
368,fressen
369,Querschnittsgelähmter Mutter ebenfalls Querschnittsgelähmt ficken Hurensohn gehen Ei fressen
370,scheißen windig windig Schule machen fressen
371,kosten einfach mal fressen halten
372,Lauterbach Halt einfach mal fressen unglaublich Tag Müll verzapfen
373,Wort Sonntag laut fressen halten Melken lassen einfach Zahlfötzchen einfach brav
374,Freedomday sein ganz Querdeppen Noafd Hirnis Kubiki Abartigen mal fressen halten
375,Lauterbach halten hässlich fressen endlich Schnauze voll Ruecktrittlauterbach
376,Us Nee fressen
377,Dubiel Boah bitte Halt fressen einfach reden Nulltoleranz Terror warum handeln Polit
378,Bund Lauterbach Halt einfach fressen
379,Kanada passieren weltweit planen beobachten Testphase gekauft Journalist
380,echt Hoffnung Vertrauen erwecken sehen völlig Mann befinden privat Feldzug vielleicht zurücktreten einfach mal fressen halten
381,fressen hören Ekelhaft schmierig englisch reden Tweet deutsch
382,direkt Boah mal richtig fressen packen
383,Lauterbach wann Hälst endlich fressen kannen Lüge Lüge verarsch Haufen Kohle dafür einstecken geben ne Kugel Lappen
384,Mann fressen halten sehen Soo gut
385,Umarmung bekommen Watzke fressen Matthäus groß Dummschwätzer Himmelszelt
386,Wort Sonntag laut fressen halten Melken lassen einfach Zahlfötzchen einfach brav
387,Lauterbach manchmal möchten einfach mal sagen Halt fressen lassen Erziehung Berlinhajorixdorfalodria
388,Oha Leon gehen weit Freund Waffe einschmuggeln fressen Krieg
389,Le weder Freiheit Person Recht Freizügigkeit angreifen Kleiderordnung Spielregel Gemeinwohl Pandemie niemand Virus fressen Rotzen oft Kopf Wand bangen
390,Riqaz vs Saz Komasy Get mal Bal up fressen
391,fressen
392,Halt eben fressen
393,souverän Staat dürfen eintreten Land dürfen Land angreifen besetzen fressen Angriff rechtfertigen kotzt einfach
394,warum sachlich Argument populistisch erschließen wohl Berufsaktivist Distanzierung Wahrheit ideologisch Traum Überschrift Posten übrigens Halt fressen
395,deutsch Kampf Antisemitismus bestehen darin jüdisch Linke Internet diffamieren Ziel Mu
396,Halt fressen
397,Idee Wärs fressen halten aufhören Rassismusbetroffen vorschreiben Schaden reden strukturell Rassismus unser Welt fügen
398,besessen davon mal fressen schlagen
399,Dipp to Bund Klaus K Hahaha klar Bot fressen sein realitätsfern
400,Halt fressen
401,Halt fressen reden
402,Nene gut fressen
403,Soooooo gehen Zig Familie ja schon gar mehr außer Ruhe fressen Ruhe Todgekämp
404,Nancy f endlich mal Spd Verein sozialdemokratisch Politik ja Arbeit verbunden Arbeit kennen oben groß fressen Plan bevormunden Drangsalieren bestrafen Gute
405,Perle Wand Eifach Jasse Schweizer Virenpartei Aktion dichtdrängen hocken jasstisch Spreaden
406,Perle Wand Eifach Jasse Schweizer Virenpartei Aktion dichtdrängen hocken jasstisch Spreaden
407,jung kennen lange nie raus gehen Collin Halt fressen
408,Frausein Klugscheissen fressen aufmachen Blablabla absondern wissen genügen erleben fressen halten einfach mal fressen halten Thema Ahnung Haltung
409,Braune Plörre reißen fressen glauben passen Dreckige Agenda Jugendliche Erwachsene Wichswichtelinnen krankenhausreif prügeln angeblich wegen Maske draufstürzen anschließend Wahrheit bekannt wortlos löschen
410,Skala halten fressen löschen Twitter hauen Eucg kaputt Dfeckigen Hornygrinder Wan Shi Tong Krieg Eule
411,Halt fressen
412,Lauterbach Halt fressen mies Panikmache Lauterbachluegt
413,leider Ahnung Amp groß fressen meist Zusammenspiel Viiiiiiel Meinung Thema Garnix angehen eher Regel Ausnahme
414,normalisieren morgens fressen halten
415,Lauterbach fressen wieviel Booster haben schon
416,Halt fressen Lennart
417,Lauterbach Jaja sterben Krankenhaus Kapazitätsgrenze Überschreiten Blabla einfach mal fressen halten helfen
418,Ahnung groß fressen ne schlecht Mischung
419,Says schon werden aggressiv handgreiflich fressen bekommen lernen weder Mitte Gesellschaft Mehrheit Leute Leben vielen Unwahrheit aufgebaut parallel Realität Leute Schiffmann
420,schon verdammen hohl Nuss Herr Audretschmeine Fressesoviel Blödheit Haufen erleben
421,direkt Boah mal richtig fressen packen
422,dermaßen Freche fressen polieren
423,bitte Halt fressen
424,Halt mal fressen
425,Wissen Dummheit schmerzen sein werden ganz Tag schreiend rumlaufen hetzerisch Parole laufen übrigens live Tv Troll Ahnung einfach mal fressen halten Mädchen
426,merken mehr Ernst nehmen fressen einschlafen
427,Fabi offensichtlich sehen Scheiße schreiben haben fressen
428,jung Halt fressen kommentieren mehr
429,Kanada passieren weltweit planen beobachten Testphase gekauft Journalist
430,machen fast Platz gut fressen halten Leute Meinung passen angewiesen
431,fressen Hàlst Alter Verschrumpelter fett Opa Gtgtgtgt
432,Kanada passieren weltweit planen beobachten Testphase gekauft Journalist
433,Verrat Martin Pandemie Maßnahme Mitmensch Infektion bewahren
434,Bar hä wieso direkt Halt fressen antworten
435,Lindner Twitter laufen Typ rumunfassbar bewegen Arsch setzen Stahlhelm hauen Russe fressen Vorteil Twitter sein werden mehr Posten Kopf gehts kaum Obwohlwenn scheißen lesen
436,hören Waldhof Radio irgendwas Spiel mitbekommen fressen Laber Scheiße is nimmer feierlich betz
437,fressen Abu
438,Artikel Witz fressen hoffen Satire meinen
439,ziehen Bursche endlich hoch fressen ey
440,jemand dumm schreiben niemand tweetet fressen halten s schreiben
441,Kloppenrath Amp fressen
442,fressen halten
443,Halt fressen
444,Nen flach Erde Tweet machen Bild Snoop Dogg posten Schild halten Halt fressen draufstehen
445,Pickel fressen
446,Kanada passieren weltweit planen beobachten Testphase gekauft Journalist
447,fressen anhand tweets zeigen linker Gesocks unterentwickeln Linke geben rechts links real Leben wohl schwarz wissen ziemlich langweilig eintönig Leben linker Hohlkörpern
448,Kanada passieren weltweit planen beobachten Testphase gekauft Journalist
449,Halt fressen Hurensohn
450,Lauterbach Halt fressen Psycho
451,Coinblock fressen
452,bitte Halt einfach fressen unlustig Dreck Edgelords schon oft reden seit einfach immer beschränken einsehen machen haben klar gehen
453,Halt peinlich trauen zwei schwarz Typ stehen haben fressen halten Hauptsache nennen anscheinend Muslim obwohl mehrfach Schwester glauben mal kennen umgehen Ayip
454,bitte Halt fressen
455,Halt fressen
456,Matthäus neuerdings Berater Süle irgendwie verbandeln fressen Süle Transfer
457,Matthäus neuerdings Berater Süle irgendwie verbandeln fressen Süle Transfer
458,Mädchen Halt einfach fressen
459,einzig hässlich Charakter Mensch fragen gut alt einfach mal fressen halten
460,Halt einfach mal fressen Dummschwätzer
461,Matthäus neuerdings Berater Süle irgendwie verbandeln fressen Süle Transfer rumreitet
462,geben Vielzahl User Sowas Tweeten Foto Posten trotzdem Dm Krieg natürlich provozieren Content fressen stellen dar sein Schuld
463,Halt fressen kommen v creativ
464,ey scheißen egal Fight Jährige ganz Zeit hören ganz Zeit Stimme verstellen Irg
465,Halt fressen hs
466,Bund Lauterbach lassen impfen Halt fressen
467,Isa Affe fressen Antwort Beispiel ja nein geben
468,all diejenigen anschicken Tweet kritisieren möchten sagen obwohl geben gewählt Formulierung Besitz halten einfach fressen
469,Verrat Martin Pandemie Maßnahme Mitmensch Infektion bewahren
470,Halt fressen Ahnung Sache haben
471,Isa Affe fressen Antwort Beispiel ja nein geben
472,gestern fressen fliegen
473,Kanada passieren weltweit planen beobachten Testphase gekauft Journalist
474,Kanada passieren weltweit planen beobachten Testphase gekauft Journalist
475,Azra Halt fressen unterscheiden kannen
476,sagen Halt fressen Tab schließen
477,Halt mal fressen
478,Arm trotz Jahr Schufterei hinzu kommen Million Kind Land Armut aufwachsen haben G
479,Halt fressen
480,Rücken Mailbox zusagen haben sagen Gesicht Halt fressen
481,nochmal ganz Schwachmattenliebe Land Kultur Nazi wer denken fressen
482,attraktiv fressen halten
483,Shithole Berlin ganz Stadt verkommen Ghetto jeglicher Art Herr Muckibuden trolls gestalten längst Nachtleben restdeutsch passen bekommen fressen simpel Fact Tran Gender Amp Co denen out
484,können gestern kaum ertragen Leute Betroffen Rassismus sollen öfter mal Sorry fressen Halt stehen einfach darüber urteilen Frage Zuhören dagegen eintreten Solidarität zeigen
485,unabhängig Davondass Typ Falschinformation verbreiten finden sowieso Erbärmlichwenn andauernd Todesfallzahlen Streitenum Pandemie Maßnahme relativieren Waaarn ja Gaaar soviele Tote fressen genau Ziel
486,ah groß fressen Jaja
487,Halt fressen Sex Marilyn Manson Malbuch
488,Kanada passieren weltweit planen beobachten Testphase gekauft Journalist
489,Wu Hackepeter Kopf Recht Ansteckung demonstrieren gehen bekommen Zweifelsfall Polizi
490,fressen fallen nix mehr
491,Hofmann Vllt Kombination fressen hören mal Bratkartoffel
492,Kanada passieren weltweit planen beobachten Testphase gekauft Journalist
493,Kanada passieren weltweit planen beobachten Testphase gekauft Journalist
494,nochmal ganz Schwachmattenliebe Land Kultur Nazi wer denken fressen
495,bitte Halt fressen
496,Soooooo gehen Zig Familie ja schon gar mehr außer Ruhe fressen Ruhe Todgekämp
497,Gesundheitssystem nie überlasten ja Maßnahme wirken Pausenaugust nennen Präventi
498,Wu Hackepeter Kopf Recht Ansteckung demonstrieren gehen bekommen Zweifelsfall Polizi
499,Soeder Fake New Tun te fressen halten erinnern
